{
  "$schema": "../docs/schema/context_buckets.schema.json",
  "version": 1,
  "dimensions": {
    "time_of_day": {
      "values": [
        "Dawn",
        "Morning",
        "Noon",
        "Afternoon",
        "Evening",
        "Night"
      ],
      "game_hours": {
        "Dawn": [
          5,
          7
        ],
        "Morning": [
          7,
          11
        ],
        "Noon": [
          11,
          14
        ],
        "Afternoon": [
          14,
          18
        ],
        "Evening": [
          18,
          22
        ],
        "Night": [
          22,
          5
        ]
      },
      "world_flag": {
        "Dawn": "IsDawn",
        "Morning": "IsDay",
        "Noon": "IsDay",
        "Afternoon": "IsDay",
        "Evening": "IsEvening",
        "Night": "IsNight"
      }
    },
    "region_state": {
      "values": [
        "Peace",
        "Alert",
        "War",
        "Disaster"
      ],
      "world_flag": {
        "Peace": "RegionPeaceful",
        "Alert": "RegionPeaceful",
        "War": "RegionUnderAttack",
        "Disaster": "RegionUnderAttack"
      }
    },
    "climate": {
      "values": [
        "Fair",
        "Cold",
        "Storm"
      ],
      "world_flag": {
        "Fair": null,
        "Cold": null,
        "Storm": "WeatherHarsh"
      }
    }
  },
  "key_format": "{archetype}@{time_of_day}.{region_state}.{climate}",
  "key_example": "blacksmith@Evening.War.Cold",
  "index_formula": "((archetype * 6 + time_of_day) * 4 + region_state) * 3 + climate",
  "total_keys": 216,
  "prebake_priority": [
    {
      "region_state": "Peace",
      "weight": 10
    },
    {
      "region_state": "Alert",
      "weight": 3
    },
    {
      "region_state": "War",
      "weight": 2
    },
    {
      "region_state": "Disaster",
      "weight": 1
    }
  ]
}
